{
  "grid_width": "13/4800",
  "height_numerators": [
    120,
    107,
    94,
    84,
    76,
    68,
    67,
    66,
    60,
    59,
    61,
    58,
    56,
    55,
    56,
    52,
    54,
    53,
    51,
    49,
    48,
    47,
    46,
    46,
    45,
    42,
    40,
    39,
    39,
    37,
    36,
    33,
    34,
    32,
    29,
    26,
    26,
    26,
    22,
    20,
    20,
    20,
    17,
    13,
    12,
    7,
    7,
    4,
    2,
    1,
    1,
    1,
    0,
    1,
    1,
    1,
    0,
    0,
    1,
    1,
    0,
    0,
    1,
    1,
    0,
    1,
    0,
    0,
    1,
    1,
    0,
    0,
    0,
    0,
    1,
    1,
    2,
    1,
    0,
    0,
    0,
    0,
    0,
    1,
    1,
    1,
    3,
    2,
    1,
    2,
    1,
    1,
    1,
    0,
    1,
    2,
    1,
    1,
    3,
    1,
    1,
    1,
    1,
    1,
    2,
    1,
    1,
    2,
    2,
    3,
    15,
    3,
    0,
    2,
    2,
    4,
    4,
    1,
    4,
    4,
    4,
    1,
    7,
    6,
    4,
    2,
    4,
    4,
    6,
    4,
    5,
    2,
    4,
    3,
    4,
    6,
    4,
    5,
    4,
    5,
    6,
    6,
    8,
    5,
    5,
    6,
    4,
    11,
    5,
    4,
    5,
    7,
    8,
    6,
    8,
    7,
    8,
    9,
    8,
    7,
    6,
    8,
    7,
    6,
    6,
    7,
    7,
    7,
    8,
    7,
    8,
    10,
    8,
    8,
    10,
    8,
    7,
    7,
    9,
    8,
    7,
    10,
    10,
    11,
    12,
    11,
    10,
    7,
    6,
    8,
    9,
    10,
    7,
    9,
    8,
    9,
    11,
    10,
    10,
    11,
    11,
    10,
    11,
    11,
    14,
    11,
    12,
    11,
    12,
    12,
    12,
    10,
    11,
    12,
    10,
    10,
    9,
    8,
    9,
    8,
    12,
    18,
    12,
    10,
    12,
    13,
    11,
    10,
    12,
    12,
    11,
    11,
    14,
    12,
    13,
    13,
    11,
    12,
    14,
    14,
    12,
    13,
    13,
    15,
    12,
    14,
    11,
    14,
    13,
    13,
    12,
    14,
    14,
    14,
    16,
    11,
    13,
    11,
    21,
    12,
    8,
    9,
    11,
    12,
    15,
    13,
    15,
    14,
    14,
    13,
    13,
    15,
    14,
    13,
    15,
    16,
    15,
    14,
    15,
    14,
    15,
    15,
    15,
    14,
    16,
    15,
    16,
    16,
    16,
    14,
    14,
    13,
    13,
    16,
    14,
    16,
    15,
    13,
    14,
    13,
    11,
    14,
    13,
    13,
    14,
    14,
    13,
    14,
    14,
    13,
    14,
    14,
    14,
    12,
    15,
    13,
    15,
    15,
    18,
    17,
    17,
    19,
    17,
    20,
    20,
    20,
    19,
    18,
    18,
    16,
    15,
    14,
    16,
    16,
    14,
    15,
    15,
    15,
    13,
    13,
    14,
    9,
    10,
    13,
    10,
    9,
    10,
    9,
    11,
    8,
    8,
    10,
    7,
    9,
    9,
    10,
    11,
    10,
    10,
    11,
    13,
    13,
    15,
    16,
    20,
    27,
    25,
    28,
    11,
    108,
    102,
    64,
    39,
    16,
    1,
    0,
    0,
    0,
    0,
    0,
    0,
    0,
    0,
    0,
    0,
    0,
    0,
    0,
    0,
    0,
    0,
    0,
    0,
    0,
    0,
    0,
    0,
    0,
    0,
    0,
    0,
    0,
    0,
    0,
    0,
    0,
    0,
    0,
    0,
    0,
    0,
    0,
    0,
    0,
    0,
    0,
    0,
    0,
    0,
    0,
    0,
    0,
    0,
    0,
    0,
    0,
    0,
    0,
    0,
    0,
    0,
    0,
    0,
    0,
    0,
    0,
    0,
    0,
    0,
    0,
    0,
    0,
    0,
    0,
    0,
    0,
    0,
    0,
    0,
    0,
    0,
    0,
    0,
    0,
    0,
    1,
    1,
    0,
    0,
    0,
    0,
    0,
    0,
    0,
    0,
    0,
    0,
    0,
    0,
    0,
    0,
    0,
    0,
    0,
    0,
    0,
    2,
    2,
    1,
    2
  ],
  "claimed_score": "2378625/5958277",
  "source": "minimum-autocorrelation-bound@b23f2d3"
}
